[
  {
    "id": "EW-0001",
    "category": "taboo",
    "rule": "用AI生成高潮情节的多个版本细纲，对比分析哪种收获感和反馈感最强，以此为蓝本起笔或参考",
    "why": "编辑星河指出顶级作者的真实AI用法：不是让AI写正文，而是用AI快速穷举高潮方案，再由人判断哪个最有爆发力",
    "severity": "soft",
    "applies_to": [
      "all_chapters"
    ],
    "source_files": [
      "001_AI写小说是否可行，编辑星河观点分享.md"
    ]
  },
  {
    "id": "EW-0002",
    "category": "taboo",
    "rule": "输入角色的性格与习惯设定，让AI列出配角（尤其女配）遭遇关键事件时的多种反应方式，挑选最合理吸引人的方案加以改编",
    "why": "用AI穷举角色行为可能性，能快速发现超出作者惯性思维的人物弧光，同时保证最终选择由人审美判断",
    "severity": "soft",
    "applies_to": [
      "all_chapters"
    ],
    "source_files": [
      "001_AI写小说是否可行，编辑星河观点分享.md"
    ]
  },
  {
    "id": "EW-0003",
    "category": "taboo",
    "rule": "禁止用AI大段生成正文水字数，AI输出的文字必须经过人工深度改写，否则极易触发平台违规判定",
    "why": "编辑明确指出'只知道水文混字数的AI使用方式是最低级、最容易被网站判定违规的'",
    "severity": "hard",
    "applies_to": [
      "all_chapters"
    ],
    "source_files": [
      "001_AI写小说是否可行，编辑星河观点分享.md"
    ]
  }
]
